{
  "$schema": "./schemas/provenance.lock.schema.json",
  "version": 1,
  "generatedAt": "2026-08-29T12:00:00+09:00",
  "generatedBy": "Gate 0 regeneration on this repository (dsh-evolve-le reimplementation); verify with `pnpm provenance:check`",
  "upstreams": {
    "deepseek-harness": {
      "path": "./deepseek-harness",
      "vcs": "git",
      "commit": "47f943859bef60e4160492346772ded9b24f765a",
      "remote": {
        "owner": "deepseek-ai",
        "repo": "deepseek-harness"
      },
      "describe": "47f9438",
      "packageJsonVersion": "0.1.0-rc.5",
      "nodeVersion": ">=22.19.0 || >=24.0.0",
      "packageManager": "pnpm@11.7.0",
      "lockfileIntegrity": {
        "algo": "sha256",
        "value": "6177ec61bdb8194eb5a606813a62ffb0ab2cc7fdfe2cd6e0249dcbfe4bce58e0"
      },
      "snapshot": {
        "mode": "tarball",
        "url": "https://codeload.github.com/deepseek-ai/deepseek-harness/tar.gz/47f943859bef60e4160492346772ded9b24f765a",
        "tarballSha256": "534c9f1c9d30fea136026ecf7a23c2137e350f43558e2f1eff6218aef7b15b26",
        "fileCount": 7412,
        "treeDigest": {
          "algo": "dsh-evolve-tree-v1",
          "value": "e7dd80d01333ba9e376ce0ea5e0bc3dbd7ed895111d672cc1d3f1a7362d43479"
        }
      }
    },
    "harbor": {
      "path": "./harbor",
      "vcs": "git",
      "commit": "ac398bbda7c4c1073461797d3b95c2455cc671b5",
      "remote": {
        "owner": "laude-institute",
        "repo": "harbor"
      },
      "packageManager": "uv",
      "snapshot": {
        "mode": "tarball",
        "url": "https://codeload.github.com/laude-institute/harbor/tar.gz/ac398bbda7c4c1073461797d3b95c2455cc671b5",
        "tarballSha256": "51e3fd7ac8aa026efbe679a69b07bef710d351a4a78954a4e976250a1a2bbe2f",
        "fileCount": 3104,
        "treeDigest": {
          "algo": "dsh-evolve-tree-v1",
          "value": "13fbc208523731b31409546da5270261e73e3a304d17a74a2483732fc749c5c3"
        }
      }
    },
    "terminal-bench": {
      "path": "./tb",
      "vcs": "git",
      "commit": "d28711d0da2675d0bb1d56de45ae5df6082438a3",
      "remote": {
        "owner": "laude-institute",
        "repo": "terminal-bench"
      },
      "packageManager": "uv",
      "snapshot": {
        "mode": "tarball",
        "url": "https://codeload.github.com/laude-institute/terminal-bench/tar.gz/d28711d0da2675d0bb1d56de45ae5df6082438a3",
        "tarballSha256": "ef3a5a1fde139283419ea6d470ee0a1a621fd53085533632a2ca2566cb44457c",
        "fileCount": 2474,
        "treeDigest": {
          "algo": "dsh-evolve-tree-v1",
          "value": "15a546f8a3b9060f05eac29d9acacc4085e0fdd5d8ce021198f20aa4e9b0f859"
        }
      }
    }
  },
  "references": {
    "cordisPaper": {
      "path": ".references/cordis-paper.pdf",
      "sourceUrl": "https://raw.githubusercontent.com/cordiverse/paper/948a07b369c62adb3b12e102458be5c18dfb69b9/paper.pdf",
      "algo": "sha256",
      "value": "4d48478dc0b6222d9f74d7db10ee776449b1209eb112632336544d32a49db97f",
      "note": "Cordis dynamic composition / self-evolving harness theory; API names verified against fixed source, not the paper."
    },
    "nodeRuntime": {
      "path": ".references/node-v24.14.0-linux-x64.tar.xz",
      "sourceUrl": "https://nodejs.org/dist/v24.14.0/node-v24.14.0-linux-x64.tar.xz",
      "algo": "sha256",
      "value": "41cd79bb7877c81605a9e68ec4c91547774f46a40c67a17e34d7179ef11729df",
      "note": "Pinned node runtime embedded at capsule runtime/node. Terminal-Bench 2.1 task images are per-task and almost none ship node (only the extract-elf image does), so the capsule must carry its own interpreter; the binary extracted from this tarball (member node-v24.14.0-linux-x64/bin/node) is sha256 e237a2839d0cbdc9a9a2adda1a184afc0f5b20306ffbe923af5686550472d8a8, dynamically linked against glibc (every TB image surveyed is glibc >= 2.36)."
    }
  },
  "toolchain": {
    "node": "v24.14.0",
    "pnpm": "11.9.0",
    "python": "3.12.3",
    "uv": "0.11.29",
    "docker": "29.3.1",
    "os": "Ubuntu 24.04.3 LTS (Noble Numbat) on WSL2",
    "platform": "linux x64"
  },
  "dshPackages": {
    "note": "Pinned @deepseek-ai/* package versions consumed by this repository. Each version is verified against the corresponding manifest in the locked deepseek-harness checkout (vendor/* and packages/*/*). The native DSH agent/session/tool/skill closure is TCB-owned and content-addressed in capsule install-manifest; @deepseek-ai/dsh-app-boot is not published at this version, so its boot sequence is reimplemented in packages/dsh-evolve-le/src/cordis/boot.ts against the checkout source.",
    "@deepseek-ai/cordis": "4.0.1",
    "@deepseek-ai/cordis-plugin-loader": "1.0.2",
    "@deepseek-ai/cordis-plugin-include": "1.0.6",
    "@deepseek-ai/cordis-plugin-group": "1.0.1",
    "@deepseek-ai/cosmokit": "1.8.2",
    "@deepseek-ai/schemastery": "3.18.1",
    "@deepseek-ai/dsh-app-boot": "0.1.0-rc.5",
    "@deepseek-ai/dsh-agent": "0.1.0-rc.5",
    "@deepseek-ai/dsh-agent-loop": "0.1.0-rc.5",
    "@deepseek-ai/dsh-agent-default-model": "0.1.0-rc.5",
    "@deepseek-ai/dsh-agent-spine-demo": "0.1.0-rc.5",
    "@deepseek-ai/dsh-llm": "0.1.0-rc.5",
    "@deepseek-ai/dsh-session": "0.1.0-rc.5",
    "@deepseek-ai/dsh-tools": "0.1.0-rc.5",
    "@deepseek-ai/dsh-skill": "0.1.0-rc.5",
    "@deepseek-ai/dsh-token-meter": "0.1.0-rc.5",
    "@deepseek-ai/dsh-compaction-basic": "0.1.0-rc.5",
    "@deepseek-ai/dsh-subagent": "0.1.0-rc.5",
    "@deepseek-ai/dsh-tool-subagent": "0.1.0-rc.5"
  },
  "modelCatalog": {
    "note": "Model routes are content-addressed here and in every run manifest; keys never carry credentials. The provider endpoint is recorded for provenance only; live secrets live outside the repo.",
    "providers": [
      {
        "id": "deepseek-official-responses",
        "baseUrl": "https://api.deepseek.com/v1",
        "transport": "openai-responses",
        "credentialRef": "env:DEEPSEEK_API_KEY",
        "models": [
          {
            "requestedId": "deepseek-v4-flash",
            "effectiveId": "deepseek-v4-flash",
            "reasoningEffort": "high",
            "contextWindow": 1048576,
            "maxOutputTokens": 32768,
            "wireApi": "responses"
          }
        ]
      }
    ]
  },
  "verification": {
    "machineReadable": true,
    "checker": "scripts/check-provenance.ts",
    "checks": [
      "provenance.lock.json validates against schemas/provenance.lock.schema.json",
      "each upstream path exists and is either a git checkout at the recorded commit with a clean tree, or a snapshot whose dsh-evolve-tree-v1 digest matches the recorded value",
      "snapshot tarball urls address the pinned commit and their recorded sha256 anchors the materialization",
      "toolchain versions match the recorded values",
      "referenced @deepseek-ai/* package versions match the manifests in the deepseek-harness checkout",
      "content-addressed Cordis paper sha256 matches"
    ]
  }
}
